source,title,topic
ABC News,Budget to be handed down tonight,Economy
ABC News,Live: Morning news bulletin,Politics
ABC News,Live: Morning news bulletin,Politics
SBS News,Sports wrap: Matildas win again,Sport
SBS News,Markets open lower as dollar slips,Economy
ABC News,Weather update for the east coast,Weather
SBS News,Live: Morning news bulletin,Politics
ABC News,Analysis: interest rates on hold,Economy
The Guardian AU,Explainer: climate targets,Environment
ABC News,Sports wrap: Matildas win again,Sport
