arc_name,canon_or_legends,title,author,isbn13
Thrawn Trilogy (Legends),Legends,Star Wars: Heir to the Empire,Timothy Zahn,9780553296129
Thrawn Trilogy (Legends),Legends,Star Wars: Dark Force Rising,Timothy Zahn,9780553298031
Thrawn Trilogy (Legends),Legends,Star Wars: The Last Command,Timothy Zahn,9780553564921
Darth Bane Trilogy,Legends,Star Wars: Darth Bane – Path of Destruction,Drew Karpyshyn,9780345477378
Darth Bane Trilogy,Legends,Star Wars: Darth Bane – Rule of Two,Drew Karpyshyn,9780345477484
Darth Bane Trilogy,Legends,Star Wars: Darth Bane – Dynasty of Evil,Drew Karpyshyn,9780345511560
The High Republic (Phase I),Canon,Star Wars: Light of the Jedi,Charles Soule,9780593157718
