id,date,source,text,tags
1,2019-05-12,Late night talk show,"Religion should welcome reason; faith isn't fragile when questions are allowed.",religion;reason;faith
2,2020-11-03,Podcast interview,"Science gives us tools, but morality guides how we use them; freedom to doubt is essential.",science;morality;freedom
3,2021-02-18,Book signing Q&A,"I chose reason over faith because inquiry matters more than certainty.",reason;faith
4,2022-07-22,University lecture,"Morality doesn't require religion; compassion and evidence can walk hand in hand.",morality;religion
5,2023-03-05,Public debate,"Freedom to speak and to question dogma protects believers and nonbelievers alike.",freedom
6,2024-01-10,Documentary,"Science and reason help us separate tradition from truth without dismissing anyone's faith.",science;reason;faith
