idea_id,theme,format,channel,priority,date_range_start,date_range_end,copy_snippet
1,Lyric art inspired by "Colors",image,instagram,High,2026-05-20,2026-05-21,Feeling blue never looked so bright.
2,Throwback to Badlands era,thread,twitter,Medium,2026-05-21,2026-05-22,Remember when we all screamed every word?
3,Fan cover challenge,video,instagram_reels,High,2026-05-22,2026-05-23,Duet with this chorus and tag us!
4,Trivia Q&A,post,twitter,Low,2026-05-23,2026-05-24,How well do you know these deep cuts?
5,Fan art spotlight,image,instagram,High,2026-05-24,2026-05-24,Your art deserves the spotlight.